{
    "$schema": "http://json-schema.org/draft-07/schema#",
    "$id": "https://selfhelp.app/schemas/worker-release.schema.json",
    "title": "SelfHelp worker release (signed)",
    "description": "A signed SelfHelp Messenger worker release: a ready-built image that consumes the per-instance background queue (plugin operations, async jobs). Built from the same core source as the backend but pinned and resolved as a first-class artifact so an instance can run a distinct worker version. Consumed by sh-manager.",
    "type": "object",
    "required": ["kind", "id", "version", "channel", "image", "digest", "backendCompatibility", "security"],
    "additionalProperties": true,
    "properties": {
        "kind": {"const": "selfhelp-worker-release"},
        "id": {"type": "string", "minLength": 1},
        "version": {"type": "string", "minLength": 1},
        "channel": {"type": "string", "enum": ["stable", "beta", "nightly", "test"]},
        "releasedAt": {"type": "string", "description": "ISO-8601 publish timestamp stamped by assemble-release.mjs; releases published before 2026-06-12 may lack it."},
        "image": {"type": "string", "minLength": 1},
        "digest": {"type": "string", "minLength": 1},
        "builtFrom": {"type": "object"},
        "backendCompatibility": {
            "type": "object",
            "required": ["requiredCoreRange"],
            "properties": {
                "requiredCoreRange": {"type": "string"},
                "requiredApiVersion": {"type": "string"}
            }
        },
        "security": {
            "type": "object",
            "required": ["signature", "keyId"],
            "properties": {
                "signature": {"type": "string", "minLength": 1},
                "keyId": {"type": "string", "minLength": 1},
                "signedPayload": {"type": "string"},
                "signedPayloadSha256": {"type": "string"}
            }
        },
        "blocked": {"type": "boolean"}
    }
}
